EmployeeID;Name;Title;BirthDate;HireDate;Address;City;RegionID;PostalCode;HomePhone;Extension;Obs;ReportsTo
1;Ms. Nancy Davolio                                 ;Sales Representative;12/08/1968;05/01/2002;507 - 20th Ave. E. Apt. 2A;Seattle;1;98122;(206) 555-9857;5467;"Education includes a BA in psychology from Colorado State University in 1970.  She also completed ""The Art of the Cold Call.""  Nancy is a member of Toastmasters International.";2
2;Dr. Andrew Fuller                                 ;Vice President, Sales;02-19-1972;08-14-2002;908 W. Capital Way;Tacoma;1;98401;(206) 555-9482;3457;Andrew received his BTS commercial in 1974 and a Ph.D. in international marketing from the University of Dallas in 1981.  He is fluent in French and Italian and reads German.  He joined the company as a sales representative, was promoted to sales manager in January 1992 and to vice president of sales in March 1993.  Andrew is a member of the Sales Management Roundtable, the Seattle Chamber of Commerce, and the Pacific Rim Importers Association.;
3;Ms. Ruth Ellerbrock                               ;Sales Representative;07/06/1966;02/06/2008;6387 Scenic Avenue;Bothell;4;98011;(206) 555-3412;3355;Ruth has a BS degree in chemistry from Boston College (1984).  She has also completed a certificate program in food retailing management.  Ruth was hired as a sales associate in 1991 and promoted to sales representative in February 1992.;2
4;Mr. Michael Suyama                                ;Sales Representative;07/02/1981;10-17-2009;Coventry House Miner Rd.;Boston;2;98242;(819) 555-0175;428;"Michael is a graduate of Sussex University (MA, economics, 1983) and the University of California at Los Angeles (MBA, marketing, 1986).  He has also taken the courses ""Multi-Cultural Selling"" and ""Time Management for the Sales Professional.""  He is fluent in Japanese and can read and write French, Portuguese, and Spanish.";2
5;Ms. Laura Callahan                                ;Inside Sales Coordinator;01/09/1978;03/05/2004;4726 - 11th Ave. N.E.;Seattle;3;98105;(206) 555-1189;2344;Laura received a BA in psychology from the University of Washington.  She has also completed a course in business French.  She reads and writes French.;2
